{
  "$schema": "https://json-schema.org/draft/2020-12/schema",
  "title": "AI Business Lab Experiment",
  "type": "object",
  "required": [
    "schema_version",
    "experiment_id",
    "run_id",
    "problem",
    "hypothesis",
    "procedure",
    "success_metrics"
  ],
  "properties": {
    "schema_version": {
      "const": "1.0"
    },
    "experiment_id": {
      "type": "string"
    },
    "run_id": {
      "type": "string"
    },
    "problem": {
      "type": "string",
      "minLength": 1
    },
    "target_viewer": {
      "type": "string"
    },
    "hypothesis": {
      "type": "string",
      "minLength": 1
    },
    "baseline": {
      "type": "object"
    },
    "intervention": {
      "type": "object"
    },
    "procedure": {
      "type": "array",
      "items": {
        "type": "string"
      }
    },
    "success_metrics": {
      "type": "array",
      "items": {
        "type": "object",
        "required": [
          "name",
          "target"
        ],
        "properties": {
          "name": {
            "type": "string"
          },
          "target": {}
        }
      }
    },
    "stopping_conditions": {
      "type": "array",
      "items": {
        "type": "string"
      }
    },
    "constraints": {
      "type": "array",
      "items": {
        "type": "string"
      }
    }
  },
  "additionalProperties": false
}
